{
  "contract": {
    "contract_version": "IND_ACQ_V1",
    "template_id": "IND_ACQ_MT",
    "template_version_target": "1.0.0",
    "request_id": "case_003_multi_tenant",
    "currency": "USD"
  },
  "deal": {
    "project_name": "Metro Industrial Park",
    "city": "Houston",
    "state": "TX",
    "analysis_start_date": "2025-01-01",
    "hold_period_months": 84,
    "gross_sf": 120000,
    "net_sf": 115000
  },
  "acquisition": {
    "purchase_price": 12500000,
    "closing_cost_pct": 0.015,
    "acquisition_fee_pct": 0.01,
    "legal_costs": 25000,
    "other_financing_fees": 10000
  },
  "operating": {
    "vacancy_pct": 0.05,
    "credit_loss_pct": 0.02,
    "inflation": {
      "rent": 0.03,
      "expenses": 0.025,
      "taxes": 0.02
    },
    "expenses": {
      "management_fee_pct_egi": 0.04,
      "fixed_annual": {
        "insurance": 35000,
        "utilities": 24000,
        "repairs_maintenance": 30000,
        "security": 12000,
        "property_taxes": 185000,
        "other_expense_1": 5000
      },
      "recoveries": {
        "mode": "NNN"
      },
      "capex_reserves_per_nsf_annual": 0.30
    }
  },
  "rent_roll": {
    "tenants_in_place": [
      {
        "tenant_name": "Global Distribution Co",
        "sf": 50000,
        "lease_start": "2023-06-01",
        "lease_end": "2028-05-31",
        "current_rent_psf_annual": 9.25,
        "annual_bump_pct": 0.03,
        "lease_type": "NNN",
        "free_rent_months": 0,
        "ti": { "mode": "PER_SF", "value": 0 },
        "lc": { "mode": "PCT_RENT", "value": 0 },
        "comments": "Anchor tenant, renewing at market"
      },
      {
        "tenant_name": "Swift Logistics LLC",
        "sf": 35000,
        "lease_start": "2024-01-01",
        "lease_end": "2029-12-31",
        "current_rent_psf_annual": 10.00,
        "annual_bump_pct": 0.025,
        "lease_type": "NNN",
        "free_rent_months": 0,
        "ti": { "mode": "PER_SF", "value": 5 },
        "lc": { "mode": "PCT_RENT", "value": 0.03 },
        "comments": "Mid-size logistics tenant"
      },
      {
        "tenant_name": "Regional Parts Supply",
        "sf": 30000,
        "lease_start": "2025-01-01",
        "lease_end": "2030-06-30",
        "current_rent_psf_annual": 9.50,
        "annual_bump_pct": 0.025,
        "lease_type": "NNN",
        "free_rent_months": 2,
        "ti": { "mode": "PER_SF", "value": 8 },
        "lc": { "mode": "PCT_RENT", "value": 0.04 },
        "comments": "New lease with TI/LC"
      }
    ],
    "market_rollover": [
      {
        "tenant_name": "Global Distribution Co (Renewal)",
        "market_rent_psf_annual": 11.50,
        "annual_bump_pct": 0.03,
        "lease_start": "2028-06-01",
        "lease_end": "2033-05-31",
        "lease_type": "NNN",
        "free_rent_months": 1,
        "downtime_months": 2,
        "ti": { "mode": "PER_SF", "value": 10 },
        "lc": { "mode": "PCT_RENT", "value": 0.04 }
      }
    ]
  },
  "debt": {
    "acquisition_loan": {
      "enabled": true,
      "ltv_max": 0.60,
      "amort_years": 25,
      "io_months": 12,
      "term_months": 84,
      "origination_fee_pct": 0.0075,
      "rate": {
        "type": "FIXED",
        "fixed_rate": 0.0575
      }
    }
  },
  "exit": {
    "exit_month": 84,
    "exit_cap_rate": 0.0675,
    "sale_cost_pct": 0.02,
    "forward_noi_months": 12
  }
}
