{
  "contract": {
    "contract_version": "IND_ACQ_V1",
    "template_id": "IND_ACQ",
    "template_version_target": "1.0.0",
    "request_id": "case_001",
    "currency": "USD"
  },
  "deal": {
    "project_name": "Oakwood Industrial",
    "city": "Dallas",
    "state": "TX",
    "analysis_start_date": "2025-01-01",
    "hold_period_months": 60,
    "gross_sf": 50000,
    "net_sf": 50000
  },
  "acquisition": {
    "purchase_price": 4500000,
    "closing_cost_pct": 0.015,
    "acquisition_fee_pct": 0.01,
    "legal_costs": 15000,
    "other_financing_fees": 5000
  },
  "operating": {
    "vacancy_pct": 0.05,
    "credit_loss_pct": 0.01,
    "inflation": {
      "rent": 0.025,
      "expenses": 0.025,
      "taxes": 0.02
    },
    "expenses": {
      "management_fee_pct_egi": 0.03,
      "fixed_annual": {
        "insurance": 12000,
        "utilities": 8000,
        "repairs_maintenance": 10000,
        "security": 0,
        "property_taxes": 75000,
        "other_expense_1": 0
      },
      "recoveries": {
        "mode": "NNN"
      },
      "capex_reserves_per_nsf_annual": 0.25
    }
  },
  "rent_roll": {
    "tenants_in_place": [
      {
        "tenant_name": "Precision Logistics",
        "sf": 50000,
        "lease_start": "2025-01-01",
        "lease_end": "2032-12-31",
        "current_rent_psf_annual": 8.50,
        "annual_bump_pct": 0.025,
        "lease_type": "NNN",
        "free_rent_months": 0,
        "ti": {
          "mode": "PER_SF",
          "value": 0
        },
        "lc": {
          "mode": "PCT_RENT",
          "value": 0
        },
        "comments": "8-year NNN industrial lease"
      }
    ]
  },
  "debt": {
    "acquisition_loan": {
      "enabled": true,
      "ltv_max": 0.65,
      "amort_years": 30,
      "io_months": 24,
      "term_months": 60,
      "origination_fee_pct": 0.01,
      "rate": {
        "type": "FIXED",
        "fixed_rate": 0.055
      }
    }
  },
  "exit": {
    "exit_month": 60,
    "exit_cap_rate": 0.07,
    "sale_cost_pct": 0.02,
    "forward_noi_months": 12
  }
}
