{
  "contract": {
    "contract_version": "IND_ACQ_V1",
    "template_id": "IND_ACQ_MT",
    "template_version_target": "1.0.0",
    "request_id": "case_004_mt_rollover",
    "currency": "USD"
  },
  "deal": {
    "project_name": "Metro Flex Center",
    "city": "Dallas",
    "state": "TX",
    "analysis_start_date": "2025-01-01",
    "hold_period_months": 84,
    "gross_sf": 120000,
    "net_sf": 118000
  },
  "acquisition": {
    "purchase_price": 14000000,
    "closing_cost_pct": 0.015,
    "acquisition_fee_pct": 0.01,
    "legal_costs": 30000,
    "other_financing_fees": 15000
  },
  "operating": {
    "vacancy_pct": 0.05,
    "credit_loss_pct": 0.02,
    "inflation": {
      "rent": 0.03,
      "expenses": 0.025,
      "taxes": 0.02
    },
    "expenses": {
      "management_fee_pct_egi": 0.04,
      "fixed_annual": {
        "insurance": 42000,
        "utilities": 30000,
        "repairs_maintenance": 36000,
        "security": 15000,
        "property_taxes": 210000,
        "other_expense_1": 8000
      },
      "recoveries": {
        "mode": "NNN"
      },
      "capex_reserves_per_nsf_annual": 0.30
    }
  },
  "rent_roll": {
    "tenants_in_place": [
      {
        "tenant_name": "Acme Logistics",
        "sf": 60000,
        "lease_start": "2023-04-01",
        "lease_end": "2027-03-31",
        "current_rent_psf_annual": 9.50,
        "annual_bump_pct": 0.03,
        "lease_type": "NNN",
        "free_rent_months": 0,
        "ti": { "mode": "PER_SF", "value": 0 },
        "lc": { "mode": "PCT_RENT", "value": 0 },
        "comments": "Anchor tenant with rollover assumptions"
      },
      {
        "tenant_name": "Beta Supply Co",
        "sf": 35000,
        "lease_start": "2024-01-01",
        "lease_end": "2028-12-31",
        "current_rent_psf_annual": 10.25,
        "annual_bump_pct": 0.03,
        "lease_type": "NNN",
        "free_rent_months": 0,
        "ti": { "mode": "PER_SF", "value": 5 },
        "lc": { "mode": "PCT_RENT", "value": 0.03 }
      },
      {
        "tenant_name": "Gamma Corporation",
        "sf": 25000,
        "lease_start": "2024-07-01",
        "lease_end": "2029-06-30",
        "current_rent_psf_annual": 11.00,
        "annual_bump_pct": 0.025,
        "lease_type": "NNN",
        "free_rent_months": 1,
        "ti": { "mode": "PER_SF", "value": 8 },
        "lc": { "mode": "PCT_RENT", "value": 0.04 }
      }
    ],
    "market_rollover": [
      {
        "tenant_name": "Acme Logistics (Renewal)",
        "market_rent_psf_annual": 12.00,
        "annual_bump_pct": 0.03,
        "lease_start": "2027-06-01",
        "lease_end": "2032-05-31",
        "lease_type": "NNN",
        "free_rent_months": 1,
        "downtime_months": 2,
        "ti": { "mode": "PER_SF", "value": 12 },
        "lc": { "mode": "PCT_RENT", "value": 0.04 }
      }
    ]
  },
  "debt": {
    "acquisition_loan": {
      "enabled": true,
      "ltv_max": 0.60,
      "amort_years": 25,
      "io_months": 12,
      "term_months": 84,
      "origination_fee_pct": 0.0075,
      "rate": {
        "type": "FIXED",
        "fixed_rate": 0.0575
      }
    }
  },
  "exit": {
    "exit_month": 84,
    "exit_cap_rate": 0.0675,
    "sale_cost_pct": 0.02,
    "forward_noi_months": 12
  }
}
